title,authors,published,summary,url
"Relational Deep Learning: Challenges, Foundations and Next-Generation Architectures","['Vijay Prakash Dwivedi', 'Charilaos Kanatsoulis', 'Shenyang Huang', 'Jure Leskovec']",2025-06-19,"Graph machine learning has led to a significant increase in the capabilities of models that learn on arbitrary graph-structured data and has been applied to molecules, social networks, recommendation systems, and transportation, among other domains. Data in multi-tabular relational databases can also be constructed as 'relational entity graphs' for Relational Deep Learning (RDL) - a new blueprint that enables end-to-end representation learning without traditional feature engineering. Compared to arbitrary graph-structured data, relational entity graphs have key properties: (i) their structure is defined by primary-foreign key relationships between entities in different tables, (ii) the structural connectivity is a function of the relational schema defining a database, and (iii) the graph connectivity is temporal and heterogeneous in nature. In this paper, we provide a comprehensive review of RDL by first introducing the representation of relational databases as relational entity graphs, and then reviewing public benchmark datasets that have been used to develop and evaluate recent GNN-based RDL models. We discuss key challenges including large-scale multi-table integration and the complexities of modeling temporal dynamics and heterogeneous data, while also surveying foundational neural network methods and recent architectural advances specialized for relational entity graphs. Finally, we explore opportunities to unify these distinct modeling challenges, highlighting how RDL converges multiple sub-fields in graph machine learning towards the design of foundation models that can transform the processing of relational data.",http://arxiv.org/abs/2506.16654v1
Overfitting in Histopathology Model Training: The Need for Customized Architectures,"['Saghir Alfasly', 'Ghazal Alabtah', 'H. R. Tizhoosh']",2025-06-19,"This study investigates the critical problem of overfitting in deep learning models applied to histopathology image analysis. We show that simply adopting and fine-tuning large-scale models designed for natural image analysis often leads to suboptimal performance and significant overfitting when applied to histopathology tasks. Through extensive experiments with various model architectures, including ResNet variants and Vision Transformers (ViT), we show that increasing model capacity does not necessarily improve performance on histopathology datasets. Our findings emphasize the need for customized architectures specifically designed for histopathology image analysis, particularly when working with limited datasets. Using Oesophageal Adenocarcinomas public dataset, we demonstrate that simpler, domain-specific architectures can achieve comparable or better performance while minimizing overfitting.",http://arxiv.org/abs/2506.16631v1
Initial Investigation of LLM-Assisted Development of Rule-Based Clinical NLP System,"['Jianlin Shi', 'Brian T. Bucher']",2025-06-19,"Despite advances in machine learning (ML) and large language models (LLMs), rule-based natural language processing (NLP) systems remain active in clinical settings due to their interpretability and operational efficiency. However, their manual development and maintenance are labor-intensive, particularly in tasks with large linguistic variability. To overcome these limitations, we proposed a novel approach employing LLMs solely during the rule-based systems development phase. We conducted the initial experiments focusing on the first two steps of developing a rule-based NLP pipeline: find relevant snippets from the clinical note; extract informative keywords from the snippets for the rule-based named entity recognition (NER) component. Our experiments demonstrated exceptional recall in identifying clinically relevant text snippets (Deepseek: 0.98, Qwen: 0.99) and 1.0 in extracting key terms for NER. This study sheds light on a promising new direction for NLP development, enabling semi-automated or automated development of rule-based systems with significantly faster, more cost-effective, and transparent execution compared with deep learning model-based solutions.",http://arxiv.org/abs/2506.16628v1
The Role of Explanation Styles and Perceived Accuracy on Decision Making in Predictive Process Monitoring,"['Soobin Chae', 'Suhwan Lee', 'Hanna Hauptmann', 'Hajo A. Reijers', 'Xixi Lu']",2025-06-19,"Predictive Process Monitoring (PPM) often uses deep learning models to predict the future behavior of ongoing processes, such as predicting process outcomes. While these models achieve high accuracy, their lack of interpretability undermines user trust and adoption. Explainable AI (XAI) aims to address this challenge by providing the reasoning behind the predictions. However, current evaluations of XAI in PPM focus primarily on functional metrics (such as fidelity), overlooking user-centered aspects such as their effect on task performance and decision-making. This study investigates the effects of explanation styles (feature importance, rule-based, and counterfactual) and perceived AI accuracy (low or high) on decision-making in PPM. We conducted a decision-making experiment, where users were presented with the AI predictions, perceived accuracy levels, and explanations of different styles. Users' decisions were measured both before and after receiving explanations, allowing the assessment of objective metrics (Task Performance and Agreement) and subjective metrics (Decision Confidence). Our findings show that perceived accuracy and explanation style have a significant effect.",http://arxiv.org/abs/2506.16617v1
From Semantic To Instance: A Semi-Self-Supervised Learning Approach,"['Keyhan Najafian', 'Farhad Maleki', 'Lingling Jin', 'Ian Stavness']",2025-06-19,"Instance segmentation is essential for applications such as automated monitoring of plant health, growth, and yield. However, extensive effort is required to create large-scale datasets with pixel-level annotations of each object instance for developing instance segmentation models that restrict the use of deep learning in these areas. This challenge is more significant in images with densely packed, self-occluded objects, which are common in agriculture. To address this challenge, we propose a semi-self-supervised learning approach that requires minimal manual annotation to develop a high-performing instance segmentation model. We design GLMask, an image-mask representation for the model to focus on shape, texture, and pattern while minimizing its dependence on color features. We develop a pipeline to generate semantic segmentation and then transform it into instance-level segmentation. The proposed approach substantially outperforms the conventional instance segmentation models, establishing a state-of-the-art wheat head instance segmentation model with mAP@50 of 98.5%. Additionally, we assessed the proposed methodology on the general-purpose Microsoft COCO dataset, achieving a significant performance improvement of over 12.6% mAP@50. This highlights that the utility of our proposed approach extends beyond precision agriculture and applies to other domains, specifically those with similar data characteristics.",http://arxiv.org/abs/2506.16563v1
VesselSDF: Distance Field Priors for Vascular Network Reconstruction,"['Salvatore Esposito', 'Daniel Rebain', 'Arno Onken', 'Changjian Li', 'Oisin Mac Aodha']",2025-06-19,"Accurate segmentation of vascular networks from sparse CT scan slices remains a significant challenge in medical imaging, particularly due to the thin, branching nature of vessels and the inherent sparsity between imaging planes. Existing deep learning approaches, based on binary voxel classification, often struggle with structural continuity and geometric fidelity. To address this challenge, we present VesselSDF, a novel framework that leverages signed distance fields (SDFs) for robust vessel reconstruction. Our method reformulates vessel segmentation as a continuous SDF regression problem, where each point in the volume is represented by its signed distance to the nearest vessel surface. This continuous representation inherently captures the smooth, tubular geometry of blood vessels and their branching patterns. We obtain accurate vessel reconstructions while eliminating common SDF artifacts such as floating segments, thanks to our adaptive Gaussian regularizer which ensures smoothness in regions far from vessel surfaces while producing precise geometry near the surface boundaries. Our experimental results demonstrate that VesselSDF significantly outperforms existing methods and preserves vessel geometry and connectivity, enabling more reliable vascular analysis in clinical settings.",http://arxiv.org/abs/2506.16556v1
A Free Probabilistic Framework for Analyzing the Transformer-based Language Models,['Swagatam Das'],2025-06-19,"We outline an operator-theoretic framework for analyzing transformer-based language models using the tools of free probability theory. By representing token embeddings and attention mechanisms as self-adjoint operators in a racial probability space, we reinterpret attention as a non-commutative convolution and view the layer-wise propagation of representations as an evolution governed by free additive convolution. This formalism reveals a spectral dynamical system underpinning deep transformer stacks and offers insight into their inductive biases, generalization behavior, and entropy dynamics. We derive a generalization bound based on free entropy and demonstrate that the spectral trace of transformer layers evolves predictably with depth. Our approach bridges neural architecture with non-commutative harmonic analysis, enabling principled analysis of information flow and structural complexity in large language models",http://arxiv.org/abs/2506.16550v1
BIDA: A Bi-level Interaction Decision-making Algorithm for Autonomous Vehicles in Dynamic Traffic Scenarios,"['Liyang Yu', 'Tianyi Wang', 'Junfeng Jiao', 'Fengwu Shan', 'Hongqing Chu', 'Bingzhao Gao']",2025-06-19,"In complex real-world traffic environments, autonomous vehicles (AVs) need to interact with other traffic participants while making real-time and safety-critical decisions accordingly. The unpredictability of human behaviors poses significant challenges, particularly in dynamic scenarios, such as multi-lane highways and unsignalized T-intersections. To address this gap, we design a bi-level interaction decision-making algorithm (BIDA) that integrates interactive Monte Carlo tree search (MCTS) with deep reinforcement learning (DRL), aiming to enhance interaction rationality, efficiency and safety of AVs in dynamic key traffic scenarios. Specifically, we adopt three types of DRL algorithms to construct a reliable value network and policy network, which guide the online deduction process of interactive MCTS by assisting in value update and node selection. Then, a dynamic trajectory planner and a trajectory tracking controller are designed and implemented in CARLA to ensure smooth execution of planned maneuvers. Experimental evaluations demonstrate that our BIDA not only enhances interactive deduction and reduces computational costs, but also outperforms other latest benchmarks, which exhibits superior safety, efficiency and interaction rationality under varying traffic conditions.",http://arxiv.org/abs/2506.16546v1
Consumer-friendly EEG-based Emotion Recognition System: A Multi-scale Convolutional Neural Network Approach,"['Tri Duc Ly', 'Gia H. Ngo']",2025-06-19,"EEG is a non-invasive, safe, and low-risk method to record electrophysiological signals inside the brain. Especially with recent technology developments like dry electrodes, consumer-grade EEG devices, and rapid advances in machine learning, EEG is commonly used as a resource for automatic emotion recognition. With the aim to develop a deep learning model that can perform EEG-based emotion recognition in a real-life context, we propose a novel approach to utilize multi-scale convolutional neural networks to accomplish such tasks. By implementing feature extraction kernels with many ratio coefficients as well as a new type of kernel that learns key information from four separate areas of the brain, our model consistently outperforms the state-of-the-art TSception model in predicting valence, arousal, and dominance scores across many performance evaluation metrics.",http://arxiv.org/abs/2506.16448v1
Structured Semantic 3D Reconstruction (S23DR) Challenge 2025 -- Winning solution,"['Jan Skvrna', 'Lukas Neumann']",2025-06-19,"This paper presents the winning solution for the S23DR Challenge 2025, which involves predicting a house's 3D roof wireframe from a sparse point cloud and semantic segmentations. Our method operates directly in 3D, first identifying vertex candidates from the COLMAP point cloud using Gestalt segmentations. We then employ two PointNet-like models: one to refine and classify these candidates by analyzing local cubic patches, and a second to predict edges by processing the cylindrical regions connecting vertex pairs. This two-stage, 3D deep learning approach achieved a winning Hybrid Structure Score (HSS) of 0.43 on the private leaderboard.",http://arxiv.org/abs/2506.16421v1
Efficient Transformations in Deep Learning Convolutional Neural Networks,"['Berk Yilmaz', 'Daniel Fidel Harvey', 'Prajit Dhuri']",2025-06-19,"This study investigates the integration of signal processing transformations -- Fast Fourier Transform (FFT), Walsh-Hadamard Transform (WHT), and Discrete Cosine Transform (DCT) -- within the ResNet50 convolutional neural network (CNN) model for image classification. The primary objective is to assess the trade-offs between computational efficiency, energy consumption, and classification accuracy during training and inference. Using the CIFAR-100 dataset (100 classes, 60,000 images), experiments demonstrated that incorporating WHT significantly reduced energy consumption while improving accuracy. Specifically, a baseline ResNet50 model achieved a testing accuracy of 66%, consuming an average of 25,606 kJ per model. In contrast, a modified ResNet50 incorporating WHT in the early convolutional layers achieved 74% accuracy, and an enhanced version with WHT applied to both early and late layers achieved 79% accuracy, with an average energy consumption of only 39 kJ per model. These results demonstrate the potential of WHT as a highly efficient and effective approach for energy-constrained CNN applications.",http://arxiv.org/abs/2506.16418v1
AGE-US: automated gestational age estimation based on fetal ultrasound images,"['César Díaz-Parga', 'Marta Nuñez-Garcia', 'Maria J. Carreira', 'Gabriel Bernardino', 'Nicolás Vila-Blanco']",2025-06-19,"Being born small carries significant health risks, including increased neonatal mortality and a higher likelihood of future cardiac diseases. Accurate estimation of gestational age is critical for monitoring fetal growth, but traditional methods, such as estimation based on the last menstrual period, are in some situations difficult to obtain. While ultrasound-based approaches offer greater reliability, they rely on manual measurements that introduce variability. This study presents an interpretable deep learning-based method for automated gestational age calculation, leveraging a novel segmentation architecture and distance maps to overcome dataset limitations and the scarcity of segmentation masks. Our approach achieves performance comparable to state-of-the-art models while reducing complexity, making it particularly suitable for resource-constrained settings and with limited annotated data. Furthermore, our results demonstrate that the use of distance maps is particularly suitable for estimating femur endpoints.",http://arxiv.org/abs/2506.16256v1
NetSenseML: Network-Adaptive Compression for Efficient Distributed Machine Learning,"['Yisu Wang', 'Xinjiao Li', 'Ruilong Wu', 'Huangxun Chen', 'Dirk Kutscher']",2025-06-19,"Training large-scale distributed machine learning models imposes considerable demands on network infrastructure, often resulting in sudden traffic spikes that lead to congestion, increased latency, and reduced throughput, which would ultimately affect convergence times and overall training performance. While gradient compression techniques are commonly employed to alleviate network load, they frequently compromise model accuracy due to the loss of gradient information.   This paper introduces NetSenseML, a novel network adaptive distributed deep learning framework that dynamically adjusts quantization, pruning, and compression strategies in response to real-time network conditions. By actively monitoring network conditions, NetSenseML applies gradient compression only when network congestion negatively impacts convergence speed, thus effectively balancing data payload reduction and model accuracy preservation.   Our approach ensures efficient resource usage by adapting reduction techniques based on current network conditions, leading to shorter convergence times and improved training efficiency. We present the design of the NetSenseML adaptive data reduction function and experimental evaluations show that NetSenseML can improve training throughput by a factor of 1.55 to 9.84 times compared to state-of-the-art compression-enabled systems for representative DDL training jobs in bandwidth-constrained conditions.",http://arxiv.org/abs/2506.16235v1
AeroGPT: Leveraging Large-Scale Audio Model for Aero-Engine Bearing Fault Diagnosis,"['Jiale Liu', 'Dandan Peng', 'Huan Wang', 'Chenyu Liu', 'Yan-Fu Li', 'Min Xie']",2025-06-19,"Aerospace engines, as critical components in aviation and aerospace industries, require continuous and accurate fault diagnosis to ensure operational safety and prevent catastrophic failures. While deep learning techniques have been extensively studied in this context, they output logits or confidence scores, necessitating post-processing to derive actionable insights. Furthermore, the potential of large-scale audio models in this domain remains largely untapped. To address these limitations, this paper proposes AeroGPT, a novel framework that transfers knowledge from general audio domain to aero-engine bearing fault diagnosis. AeroGPT is a framework based on large-scale audio model that incorporates Vibration Signal Alignment (VSA) to adapt general audio knowledge to domain-specific vibration patterns, and combines Generative Fault Classification (GFC) to directly output interpretable fault labels. This approach eliminates the need for post-processing of fault labels, supports interactive, interpretable, and actionable fault diagnosis, thereby greatly enhancing industrial applicability. Through comprehensive experimental validation on two aero-engine bearing datasets, AeroGPT achieved exceptional performance with 98.94% accuracy on the DIRG dataset and perfect 100% classification on the HIT bearing dataset, surpassing traditional deep learning approaches. Additional Qualitative analysis validates the effectiveness of our approach and highlights the potential of large-scale models to revolutionize fault diagnosis.",http://arxiv.org/abs/2506.16225v1
From Pixels to CSI: Distilling Latent Dynamics For Efficient Wireless Resource Management,"['Charbel Bou Chaaya', 'Abanoub M. Girgis', 'Mehdi Bennis']",2025-06-19,"In this work, we aim to optimize the radio resource management of a communication system between a remote controller and its device, whose state is represented through image frames, without compromising the performance of the control task. We propose a novel machine learning (ML) technique to jointly model and predict the dynamics of the control system as well as the wireless propagation environment in latent space. Our method leverages two coupled joint-embedding predictive architectures (JEPAs): a control JEPA models the control dynamics and guides the predictions of a wireless JEPA, which captures the dynamics of the device's channel state information (CSI) through cross-modal conditioning. We then train a deep reinforcement learning (RL) algorithm to derive a control policy from latent control dynamics and a power predictor to estimate scheduling intervals with favorable channel conditions based on latent CSI representations. As such, the controller minimizes the usage of radio resources by utilizing the coupled JEPA networks to imagine the device's trajectory in latent space. We present simulation results on synthetic multimodal data and show that our proposed approach reduces transmit power by over 50% while maintaining control performance comparable to baseline methods that do not account for wireless optimization.",http://arxiv.org/abs/2506.16216v1
Solar Transient Recognition Using Deep Learning (STRUDL) for heliospheric imager data,"['Maike Bauer', 'Justin Le Louëdec', 'Tanja Amerstorfer', 'Luke Barnard', 'David Barnes', 'Helmut Lammer']",2025-06-19,"Coronal Mass Ejections (CMEs) are space weather phenomena capable of causing significant disruptions to both space- and ground-based infrastructure. The timely and accurate detection and prediction of CMEs is a crucial steps towards implementing strategies to minimize the impacts of such events. CMEs are commonly observed using coronagraphs and heliospheric imagers (HIs), with some forecasting methods relying on manually tracking CMEs across successive images in order to provide an estimate of their arrival time and speed. This process is time-consuming, and the growing volume of available data makes manual identification of CMEs increasingly impractical.   We investigate the application of machine learning (ML) techniques to the problem of automated CME detection, focusing on data from the HI instruments aboard the STEREO spacecraft. HI data facilitates the tracking of CMEs through interplanetary space, providing valuable information on their evolution along the way. Building on advances in image segmentation, we present the Solar Transient Recognition Using Deep Learning (STRUDL) model. STRUDL is designed to automatically detect and segment CME fronts in HI data. We address the challenges inherent to this task and evaluate the model's performance across a range of solar activity conditions. To complement segmentation, we implement a basic tracking algorithm that links CME detections across successive frames, thus allowing us to automatically generate time-distance profiles for all CMEs under study.   Our results demonstrate the feasibility of applying ML-based segmentation techniques to HI data, while highlighting areas for future improvement, particularly regarding the accurate segmentation and tracking of faint and interacting CMEs.",http://arxiv.org/abs/2506.16194v1
DCFNet: Doppler Correction Filter Network for Integrated Sensing and Communication in Multi-User MIMO-OFDM Systems,"['Hyeonho Noh', 'Hyeonsu Lyu', 'Moe Z. Win', 'Hyun Jong Yang']",2025-06-19,"Integrated sensing and communication (ISAC) is a headline feature for the forthcoming IMT-2030 and 6G releases, yet a concrete solution that fits within the established orthogonal frequency division multiplexing (OFDM) family remains open. Specifically, Doppler-induced inter-carrier interference (ICI) destroys sub-carrier orthogonality of OFDM sensing signals, blurring range-velocity maps and severely degrading sensing accuracy. Building on multi-user multi-input-multi-output (MIMO) OFDM systems, this paper proposes Doppler-Correction Filter Network (DCFNet), an AI-native ISAC model that delivers fine range-velocity resolution at minimal complexity without altering the legacy frame structure. A bank of DCFs first shifts dominant ICI energy away from critical Doppler bins; a compact deep learning network then suppresses the ICI. To further enhance the range and velocity resolutions, we propose DCFNet with local refinement (DCFNet-LR), which applies a generalized likelihood ratio test (GLRT) to refine target estimates of DCFNet to sub-cell accuracy. Simulation results show that DCFNet-LR runs $143\times$ faster than maximum likelihood search and achieves significantly superior performance, reducing the range RMSE by up to $2.7 \times 10^{-4}$ times and the velocity RMSE by $6.7 \times 10^{-4}$ times compared to conventional detection methods.",http://arxiv.org/abs/2506.16191v1
