title,authors,published,summary,url
Cross-Modality Learning for Predicting IHC Biomarkers from H&E-Stained Whole-Slide Images,"['Amit Das', 'Naofumi Tomita', 'Kyle J. Syme', 'Weijie Ma', ""Paige O'Connor"", 'Kristin N. Corbett', 'Bing Ren', 'Xiaoying Liu', 'Saeed Hassanpour']",2025-06-18,"Hematoxylin and Eosin (H&E) staining is a cornerstone of pathological analysis, offering reliable visualization of cellular morphology and tissue architecture for cancer diagnosis, subtyping, and grading. Immunohistochemistry (IHC) staining provides molecular insights by detecting specific proteins within tissues, enhancing diagnostic accuracy, and improving treatment planning. However, IHC staining is costly, time-consuming, and resource-intensive, requiring specialized expertise. To address these limitations, this study proposes HistoStainAlign, a novel deep learning framework that predicts IHC staining patterns directly from H&E whole-slide images (WSIs) by learning joint representations of morphological and molecular features. The framework integrates paired H&E and IHC embeddings through a contrastive training strategy, capturing complementary features across staining modalities without patch-level annotations or tissue registration. The model was evaluated on gastrointestinal and lung tissue WSIs with three commonly used IHC stains: P53, PD-L1, and Ki-67. HistoStainAlign achieved weighted F1 scores of 0.735 [95% Confidence Interval (CI): 0.670-0.799], 0.830 [95% CI: 0.772-0.886], and 0.723 [95% CI: 0.607-0.836], respectively for these three IHC stains. Embedding analyses demonstrated the robustness of the contrastive alignment in capturing meaningful cross-stain relationships. Comparisons with a baseline model further highlight the advantage of incorporating contrastive learning for improved stain pattern prediction. This study demonstrates the potential of computational approaches to serve as a pre-screening tool, helping prioritize cases for IHC staining and improving workflow efficiency.",http://arxiv.org/abs/2506.15853v1
Assessing the impact of Binarization for Writer Identification in Greek Papyrus,"['Dominic Akt', 'Marco Peer', 'Florian Kleber']",2025-06-18,"This paper tackles the task of writer identification for Greek papyri. A common preprocessing step in writer identification pipelines is image binarization, which prevents the model from learning background features. This is challenging in historical documents, in our case Greek papyri, as background is often non-uniform, fragmented, and discolored with visible fiber structures. We compare traditional binarization methods to state-of-the-art Deep Learning (DL) models, evaluating the impact of binarization quality on subsequent writer identification performance. DL models are trained with and without a custom data augmentation technique, as well as different model selection criteria are applied. The performance of these binarization methods, is then systematically evaluated on the DIBCO 2019 dataset. The impact of binarization on writer identification is subsequently evaluated using a state-of-the-art approach for writer identification. The results of this analysis highlight the influence of data augmentation for DL methods. Furthermore, findings indicate a strong correlation between binarization effectiveness on papyri documents of DIBCO 2019 and downstream writer identification performance.",http://arxiv.org/abs/2506.15852v1
Semantic and Feature Guided Uncertainty Quantification of Visual Localization for Autonomous Vehicles,"['Qiyuan Wu', 'Mark Campbell']",2025-06-18,"The uncertainty quantification of sensor measurements coupled with deep learning networks is crucial for many robotics systems, especially for safety-critical applications such as self-driving cars. This paper develops an uncertainty quantification approach in the context of visual localization for autonomous driving, where locations are selected based on images. Key to our approach is to learn the measurement uncertainty using light-weight sensor error model, which maps both image feature and semantic information to 2-dimensional error distribution. Our approach enables uncertainty estimation conditioned on the specific context of the matched image pair, implicitly capturing other critical, unannotated factors (e.g., city vs highway, dynamic vs static scenes, winter vs summer) in a latent manner. We demonstrate the accuracy of our uncertainty prediction framework using the Ithaca365 dataset, which includes variations in lighting and weather (sunny, night, snowy). Both the uncertainty quantification of the sensor+network is evaluated, along with Bayesian localization filters using unique sensor gating method. Results show that the measurement error does not follow a Gaussian distribution with poor weather and lighting conditions, and is better predicted by our Gaussian Mixture model.",http://arxiv.org/abs/2506.15851v1
Heterogeneous Federated Reinforcement Learning Using Wasserstein Barycenters,"['Luiz Pereira', 'M. Hadi Amini']",2025-06-18,"In this paper, we first propose a novel algorithm for model fusion that leverages Wasserstein barycenters in training a global Deep Neural Network (DNN) in a distributed architecture. To this end, we divide the dataset into equal parts that are fed to ""agents"" who have identical deep neural networks and train only over the dataset fed to them (known as the local dataset). After some training iterations, we perform an aggregation step where we combine the weight parameters of all neural networks using Wasserstein barycenters. These steps form the proposed algorithm referred to as FedWB. Moreover, we leverage the processes created in the first part of the paper to develop an algorithm to tackle Heterogeneous Federated Reinforcement Learning (HFRL). Our test experiment is the CartPole toy problem, where we vary the lengths of the poles to create heterogeneous environments. We train a deep Q-Network (DQN) in each environment to learn to control each cart, while occasionally performing a global aggregation step to generalize the local models; the end outcome is a global DQN that functions across all environments.",http://arxiv.org/abs/2506.15825v1
DeepJ: Graph Convolutional Transformers with Differentiable Pooling for Patient Trajectory Modeling,"['Deyi Li', 'Zijun Yao', 'Muxuan Liang', 'Mei Liu']",2025-06-18,"In recent years, graph learning has gained significant interest for modeling complex interactions among medical events in structured Electronic Health Record (EHR) data. However, existing graph-based approaches often work in a static manner, either restricting interactions within individual encounters or collapsing all historical encounters into a single snapshot. As a result, when it is necessary to identify meaningful groups of medical events spanning longitudinal encounters, existing methods are inadequate in modeling interactions cross encounters while accounting for temporal dependencies. To address this limitation, we introduce Deep Patient Journey (DeepJ), a novel graph convolutional transformer model with differentiable graph pooling to effectively capture intra-encounter and inter-encounter medical event interactions. DeepJ can identify groups of temporally and functionally related medical events, offering valuable insights into key event clusters pertinent to patient outcome prediction. DeepJ significantly outperformed five state-of-the-art baseline models while enhancing interpretability, demonstrating its potential for improved patient risk stratification.",http://arxiv.org/abs/2506.15809v1
Hybrid Near-Far Field 6D Movable Antenna Design Exploiting Directional Sparsity and Deep Learning,"['Xiaodan Shao', 'Limei Hu', 'Yulong Sun', 'Xing Li', 'Yixiao Zhang', 'Jingze Ding', 'Xiaoming Shi', 'Feng Chen', 'Derrick Wing Kwan Ng', 'Robert Schober']",2025-06-18,"Six-dimensional movable antenna (6DMA) has been identified as a new disruptive technology for future wireless systems to support a large number of users with only a few antennas. However, the intricate relationships between the signal carrier wavelength and the transceiver region size lead to inaccuracies in traditional far-field 6DMA channel model, causing discrepancies between the model predictions and the hybrid-field channel characteristics in practical 6DMA systems, where users might be in the far-field region relative to the antennas on the same 6DMA surface, while simultaneously being in the near-field region relative to different 6DMA surfaces. Moreover, due to the high-dimensional channel and the coupled position and rotation constraints, the estimation of the 6DMA channel and the joint design of the 6DMA positions and rotations and the transmit beamforming at the base station (BS) incur extremely high computational complexity. To address these issues, we propose an efficient hybrid-field generalized 6DMA channel model, which accounts for planar-wave propagation within individual 6DMA surfaces and spherical-wave propagation among different 6DMA surfaces. Furthermore, by leveraging directional sparsity, we propose a low-overhead channel estimation algorithm that efficiently constructs a complete channel map for all potential antenna position-rotation pairs while limiting the training overhead incurred by antenna movement. In addition, we propose a low-complexity design leveraging deep reinforcement learning (DRL), which facilitates the joint design of the 6DMA positions, rotations, and beamforming in a unified manner. Numerical results demonstrate that the proposed hybrid-field channel model and channel estimation algorithm outperform existing approaches and that the DRL-enhanced 6DMA system significantly surpasses flexible antenna systems.",http://arxiv.org/abs/2506.15808v1
Implicit 3D scene reconstruction using deep learning towards efficient collision understanding in autonomous driving,"['Akarshani Ramanayake', 'Nihal Kodikara']",2025-06-18,"In crowded urban environments where traffic is dense, current technologies struggle to oversee tight navigation, but surface-level understanding allows autonomous vehicles to safely assess proximity to surrounding obstacles. 3D or 2D scene mapping of the surrounding objects is an essential task in addressing the above problem. Despite its importance in dense vehicle traffic conditions, 3D scene reconstruction of object shapes with higher boundary level accuracy is not yet entirely considered in current literature. The sign distance function represents any shape through parameters that calculate the distance from any point in space to the closest obstacle surface, making it more efficient in terms of storage. In recent studies, researchers have started to formulate problems with Implicit 3D reconstruction methods in the autonomous driving domain, highlighting the possibility of using sign distance function to map obstacles effectively. This research addresses this gap by developing a learning-based 3D scene reconstruction methodology that leverages LiDAR data and a deep neural network to build a the static Signed Distance Function (SDF) maps. Unlike traditional polygonal representations, this approach has the potential to map 3D obstacle shapes with more boundary-level details. Our preliminary results demonstrate that this method would significantly enhance collision detection performance, particularly in congested and dynamic environments.",http://arxiv.org/abs/2506.15806v1
Unsupervised deep learning model for fast energy layer pre-selection of delivery-efficient proton arc therapy plan optimization of nasopharyngeal carcinoma,"['Bohan Yang', 'Gang Liu', 'Rirao Dao', 'Yujia Qian', 'Ke Shi', 'Anke Tang', 'Yong Luo', 'Jingnan Liu']",2025-06-18,"Objective. Proton arc therapy (PAT) is an emerging and promising modality in radiotherapy, offering several advantages over conventional intensitymodulated proton therapy (IMPT). However, identifying the optimal energy layer (EL) sequence remains computationally intensive due to the large number of possible energy layer transitions. This study proposes an unsupervised deep learning framework for fast and effective EL pre-selection, aiming to minimize energy layer switch time while preserving high plan quality. Approach. We introduce a novel data representation method, spot-count representation, which encodes the number of proton spots intersecting the target and organs at risk (OARs) in a matrix structured by sorted gantry angles and energy layers. This representation is the input of a UNet-based architecture, SPArcdl, which is trained to optimize a tri-objective function: maximizing target coverage, minimizing OAR exposure, and reducing energy switching time. The model is evaluated on 54 nasopharyngeal cancer cases, and its performance is benchmarked against plans generated by SPArcparticle swarm. Main results. SPArcdl produces EL pre-selection that significantly improves both plan quality and delivery efficiency. Compared to SPArc particle swarm, it enhances the conformity index by 0.16 (p < 0.01), reduces the homogeneity index by 0.71 (p < 0.01), shortens the energy switching time by 38.4% (p < 0.01), and lowers the mean dose to brainstem by 0.21 (p < 0.01). The results unintentionally reveal employing unchanged ELS is more time-wise efficient than descended ELS. SPArcdl's inference time is within 1 second. Significance. SPArcdl is a fast and effective tool for generating high-quality PAT plans by strategically pre-selecting energy layers to reduce delivery time while maintaining excellent dosimetric performance.",http://arxiv.org/abs/2506.15803v1
Graphics4Science: Computer Graphics for Scientific Impacts,"['Peter Yichen Chen', 'Minghao Guo', 'Hanspeter Pfister', 'Ming Lin', 'William Freeman', 'Qixing Huang', 'Han-Wei Shen', 'Wojciech Matusik']",2025-06-18,"Computer graphics, often associated with films, games, and visual effects, has long been a powerful tool for addressing scientific challenges--from its origins in 3D visualization for medical imaging to its role in modern computational modeling and simulation. This course explores the deep and evolving relationship between computer graphics and science, highlighting past achievements, ongoing contributions, and open questions that remain. We show how core methods, such as geometric reasoning and physical modeling, provide inductive biases that help address challenges in both fields, especially in data-scarce settings. To that end, we aim to reframe graphics as a modeling language for science by bridging vocabulary gaps between the two communities. Designed for both newcomers and experts, Graphics4Science invites the graphics community to engage with science, tackle high-impact problems where graphics expertise can make a difference, and contribute to the future of scientific discovery. Additional details are available on the course website: https://graphics4science.github.io",http://arxiv.org/abs/2506.15786v1
On the Upper Bounds for the Matrix Spectral Norm,"['Alexey Naumov', 'Maxim Rakhuba', 'Denis Ryapolov', 'Sergey Samsonov']",2025-06-18,"We consider the problem of estimating the spectral norm of a matrix using only matrix-vector products. We propose a new Counterbalance estimator that provides upper bounds on the norm and derive probabilistic guarantees on its underestimation. Compared to standard approaches such as the power method, the proposed estimator produces significantly tighter upper bounds in both synthetic and real-world settings. Our method is especially effective for matrices with fast-decaying spectra, such as those arising in deep learning and inverse problems.",http://arxiv.org/abs/2506.15660v1
Federated Learning for MRI-based BrainAGE: a multicenter study on post-stroke functional outcome prediction,"['Vincent Roca', 'Marc Tommasi', 'Paul Andrey', 'Aurélien Bellet', 'Markus D. Schirmer', 'Hilde Henon', 'Laurent Puy', 'Julien Ramon', 'Grégory Kuchcinski', 'Martin Bretzner', 'Renaud Lopes']",2025-06-18,"$\textbf{Objective:}$ Brain-predicted age difference (BrainAGE) is a neuroimaging biomarker reflecting brain health. However, training robust BrainAGE models requires large datasets, often restricted by privacy concerns. This study evaluates the performance of federated learning (FL) for BrainAGE estimation in ischemic stroke patients treated with mechanical thrombectomy, and investigates its association with clinical phenotypes and functional outcomes.   $\textbf{Methods:}$ We used FLAIR brain images from 1674 stroke patients across 16 hospital centers. We implemented standard machine learning and deep learning models for BrainAGE estimates under three data management strategies: centralized learning (pooled data), FL (local training at each site), and single-site learning. We reported prediction errors and examined associations between BrainAGE and vascular risk factors (e.g., diabetes mellitus, hypertension, smoking), as well as functional outcomes at three months post-stroke. Logistic regression evaluated BrainAGE's predictive value for these outcomes, adjusting for age, sex, vascular risk factors, stroke severity, time between MRI and arterial puncture, prior intravenous thrombolysis, and recanalisation outcome.   $\textbf{Results:}$ While centralized learning yielded the most accurate predictions, FL consistently outperformed single-site models. BrainAGE was significantly higher in patients with diabetes mellitus across all models. Comparisons between patients with good and poor functional outcomes, and multivariate predictions of these outcomes showed the significance of the association between BrainAGE and post-stroke recovery.   $\textbf{Conclusion:}$ FL enables accurate age predictions without data centralization. The strong association between BrainAGE, vascular risk factors, and post-stroke recovery highlights its potential for prognostic modeling in stroke care.",http://arxiv.org/abs/2506.15626v2
Towards Explainable Indoor Localization: Interpreting Neural Network Learning on Wi-Fi Fingerprints Using Logic Gates,"['Danish Gufran', 'Sudeep Pasricha']",2025-06-18,"Indoor localization using deep learning (DL) has demonstrated strong accuracy in mapping Wi-Fi RSS fingerprints to physical locations; however, most existing DL frameworks function as black-box models, offering limited insight into how predictions are made or how models respond to real-world noise over time. This lack of interpretability hampers our ability to understand the impact of temporal variations - caused by environmental dynamics - and to adapt models for long-term reliability. To address this, we introduce LogNet, a novel logic gate-based framework designed to interpret and enhance DL-based indoor localization. LogNet enables transparent reasoning by identifying which access points (APs) are most influential for each reference point (RP) and reveals how environmental noise disrupts DL-driven localization decisions. This interpretability allows us to trace and diagnose model failures and adapt DL systems for more stable long-term deployments. Evaluations across multiple real-world building floorplans and over two years of temporal variation show that LogNet not only interprets the internal behavior of DL models but also improves performance-achieving up to 1.1x to 2.8x lower localization error, 3.4x to 43.3x smaller model size, and 1.5x to 3.6x lower latency compared to prior DL-based models.",http://arxiv.org/abs/2506.15559v1
Design of an all-facet illuminator for high NA EUV lithography exposure tool based on deep reinforcement learning,"['Tong Li', 'Yuqing Chen', 'Yanqiu Li', 'Lihui Liu']",2025-06-18,"Using the illuminator for high numerical aperture (NA) extreme ultraviolet (EUV) exposure tool in EUV lithography can lead to support volume production of sub-2 nm logic nodes and leading-edge DRAM nodes. However, the typical design method of the illuminator has issues with the transmission owing to the limitation of optical structure that cannot further reduce process parameter k1, and uniformity due to the restriction of matching method that can only consider one factor affecting uniformity. The all-facet illuminator can improve transmission by removing relay system. Deep reinforcement learning (RL) can improve the uniformity by considering multiple factors. In this paper, a design method of the all-facet illuminator for high NA EUV lithography exposure tool and a matching method based on deep RL for the double facets are proposed. The all-facet illuminator is designed using matrix optics, and removing relay system to achieve high transmission. The double facets is matched using the deep RL framework, which includes the policy network with improved trainability and low computational demands, and the reward function with great optimization direction and fast convergence rate, enabling to rapidly generate multiple matching results with high uniformity. An all-facet illuminator for a 0.55 NA EUV lithography exposure tool is designed by the proposed method. Simulation results indicate that the transmission is greater than 35%, and uniformity exceed 99% under multiple illumination pupil shapes.",http://arxiv.org/abs/2506.15558v1
Advancing Digital Precision Medicine for Chronic Fatigue Syndrome through Longitudinal Large-Scale Multi-Modal Biological Omics Modeling with Machine Learning and Artificial Intelligence,['Ruoyun Xiong'],2025-06-18,"We studied a generalized question: chronic diseases like ME/CFS and long COVID exhibit high heterogeneity with multifactorial etiology and progression, complicating diagnosis and treatment. To address this, we developed BioMapAI, an explainable Deep Learning framework using the richest longitudinal multi-omics dataset for ME/CFS to date. This dataset includes gut metagenomics, plasma metabolome, immune profiling, blood labs, and clinical symptoms. By connecting multi-omics to a symptom matrix, BioMapAI identified both disease- and symptom-specific biomarkers, reconstructed symptoms, and achieved state-of-the-art precision in disease classification. We also created the first connectivity map of these omics in both healthy and disease states and revealed how microbiome-immune-metabolome crosstalk shifted from healthy to ME/CFS.",http://arxiv.org/abs/2506.15761v1
Construction of an Organ Shape Atlas Using a Hierarchical Mesh Variational Autoencoder,"['Zijie Wang', 'Ryuichi Umehara', 'Mitsuhiro Nakamura', 'Megumi Nakao']",2025-06-18,"An organ shape atlas, which represents the shape and position of the organs and skeleton of a living body using a small number of parameters, is expected to have a wide range of clinical applications, including intraoperative guidance and radiotherapy. Because the shape and position of soft organs vary greatly among patients, it is difficult for linear models to reconstruct shapes that have large local variations. Because it is difficult for conventional nonlinear models to control and interpret the organ shapes obtained, deep learning has been attracting attention in three-dimensional shape representation. In this study, we propose an organ shape atlas based on a mesh variational autoencoder (MeshVAE) with hierarchical latent variables. To represent the complex shapes of biological organs and nonlinear shape differences between individuals, the proposed method maintains the performance of organ shape reconstruction by hierarchizing latent variables and enables shape representation using lower-dimensional latent variables. Additionally, templates that define vertex correspondence between different resolutions enable hierarchical representation in mesh data and control the global and local features of the organ shape. We trained the model using liver and stomach organ meshes obtained from 124 cases and confirmed that the model reconstructed the position and shape with an average distance between vertices of 1.5 mm and mean distance of 0.7 mm for the liver shape, and an average distance between vertices of 1.4 mm and mean distance of 0.8 mm for the stomach shape on test data from 19 of cases. The proposed method continuously represented interpolated shapes, and by changing latent variables at different hierarchical levels, the proposed method hierarchically separated shape features compared with PCA.",http://arxiv.org/abs/2506.15557v1
