title,authors,published,summary,url
Network Sparsity Unlocks the Scaling Potential of Deep Reinforcement Learning,"['Guozheng Ma', 'Lu Li', 'Zilin Wang', 'Li Shen', 'Pierre-Luc Bacon', 'Dacheng Tao']",2025-06-20,"Effectively scaling up deep reinforcement learning models has proven notoriously difficult due to network pathologies during training, motivating various targeted interventions such as periodic reset and architectural advances such as layer normalization. Instead of pursuing more complex modifications, we show that introducing static network sparsity alone can unlock further scaling potential beyond their dense counterparts with state-of-the-art architectures. This is achieved through simple one-shot random pruning, where a predetermined percentage of network weights are randomly removed once before training. Our analysis reveals that, in contrast to naively scaling up dense DRL networks, such sparse networks achieve both higher parameter efficiency for network expressivity and stronger resistance to optimization challenges like plasticity loss and gradient interference. We further extend our evaluation to visual and streaming RL scenarios, demonstrating the consistent benefits of network sparsity.",http://arxiv.org/abs/2506.17204v1
UniFork: Exploring Modality Alignment for Unified Multimodal Understanding and Generation,"['Teng Li', 'Quanfeng Lu', 'Lirui Zhao', 'Hao Li', 'Xizhou Zhu', 'Yu Qiao', 'Jun Zhang', 'Wenqi Shao']",2025-06-20,"Unified image understanding and generation has emerged as a promising paradigm in multimodal artificial intelligence. Despite recent progress, the optimal architectural design for such unified models remains an open challenge. In this work, we start by analyzing the modality alignment behaviors of task-specific expert models for understanding and generation, as well as current unified models. Our analysis reveals a crucial observation: understanding tasks benefit from a progressively increasing modality alignment across network depth, which helps build up semantic information for better comprehension; In contrast, generation tasks follow a different trend: modality alignment increases in the early layers but decreases in the deep layers to recover spatial details. These divergent alignment patterns create a fundamental conflict in fully shared Transformer backbones, where a uniform representational flow often leads to performance compromises across two tasks. Motivated by this finding, we introduce UniFork, a novel Y-shaped architecture that shares the shallow layers for cross-task representation learning, while employing task-specific branches in deeper layers to avoid task interference. This design effectively balances shared learning and task specialization. Through extensive ablation experiments, we demonstrate that Unifork consistently outperforms conventional fully shared Transformer architectures, and achieves performance on par with or better than task-specific models.",http://arxiv.org/abs/2506.17202v1
Facial Landmark Visualization and Emotion Recognition Through Neural Networks,"['Israel Juárez-Jiménez', 'Tiffany Guadalupe Martínez Paredes', 'Jesús García-Ramírez', 'Eric Ramos Aguilar']",2025-06-20,"Emotion recognition from facial images is a crucial task in human-computer interaction, enabling machines to learn human emotions through facial expressions. Previous studies have shown that facial images can be used to train deep learning models; however, most of these studies do not include a through dataset analysis. Visualizing facial landmarks can be challenging when extracting meaningful dataset insights; to address this issue, we propose facial landmark box plots, a visualization technique designed to identify outliers in facial datasets. Additionally, we compare two sets of facial landmark features: (i) the landmarks' absolute positions and (ii) their displacements from a neutral expression to the peak of an emotional expression. Our results indicate that a neural network achieves better performance than a random forest classifier.",http://arxiv.org/abs/2506.17191v1
YASMOT: Yet another stereo image multi-object tracker,['Ketil Malde'],2025-06-20,"There now exists many popular object detectors based on deep learning that can analyze images and extract locations and class labels for occurrences of objects. For image time series (i.e., video or sequences of stills), tracking objects over time and preserving object identity can help to improve object detection performance, and is necessary for many downstream tasks, including classifying and predicting behaviors, and estimating total abundances. Here we present yasmot, a lightweight and flexible object tracker that can process the output from popular object detectors and track objects over time from either monoscopic or stereoscopic camera configurations. In addition, it includes functionality to generate consensus detections from ensembles of object detectors.",http://arxiv.org/abs/2506.17186v1
Deep generative models as the probability transformation functions,"['Vitalii Bondar', 'Vira Babenko', 'Roman Trembovetskyi', 'Yurii Korobeinyk', 'Viktoriya Dzyuba']",2025-06-20,"This paper introduces a unified theoretical perspective that views deep generative models as probability transformation functions. Despite the apparent differences in architecture and training methodologies among various types of generative models - autoencoders, autoregressive models, generative adversarial networks, normalizing flows, diffusion models, and flow matching - we demonstrate that they all fundamentally operate by transforming simple predefined distributions into complex target data distributions. This unifying perspective facilitates the transfer of methodological improvements between model architectures and provides a foundation for developing universal theoretical approaches, potentially leading to more efficient and effective generative modeling techniques.",http://arxiv.org/abs/2506.17171v1
MeDi: Metadata-Guided Diffusion Models for Mitigating Biases in Tumor Classification,"['David Jacob Drexlin', 'Jonas Dippel', 'Julius Hense', 'Niklas Prenißl', 'Grégoire Montavon', 'Frederick Klauschen', 'Klaus-Robert Müller']",2025-06-20,"Deep learning models have made significant advances in histological prediction tasks in recent years. However, for adaptation in clinical practice, their lack of robustness to varying conditions such as staining, scanner, hospital, and demographics is still a limiting factor: if trained on overrepresented subpopulations, models regularly struggle with less frequent patterns, leading to shortcut learning and biased predictions. Large-scale foundation models have not fully eliminated this issue. Therefore, we propose a novel approach explicitly modeling such metadata into a Metadata-guided generative Diffusion model framework (MeDi). MeDi allows for a targeted augmentation of underrepresented subpopulations with synthetic data, which balances limited training data and mitigates biases in downstream models. We experimentally show that MeDi generates high-quality histopathology images for unseen subpopulations in TCGA, boosts the overall fidelity of the generated images, and enables improvements in performance for downstream classifiers on datasets with subpopulation shifts. Our work is a proof-of-concept towards better mitigating data biases with generative models.",http://arxiv.org/abs/2506.17140v1
Robust Training with Data Augmentation for Medical Imaging Classification,"['Josué Martínez-Martínez', 'Olivia Brown', 'Mostafa Karami', 'Sheida Nabavi']",2025-06-20,"Deep neural networks are increasingly being used to detect and diagnose medical conditions using medical imaging. Despite their utility, these models are highly vulnerable to adversarial attacks and distribution shifts, which can affect diagnostic reliability and undermine trust among healthcare professionals. In this study, we propose a robust training algorithm with data augmentation (RTDA) to mitigate these vulnerabilities in medical image classification. We benchmark classifier robustness against adversarial perturbations and natural variations of RTDA and six competing baseline techniques, including adversarial training and data augmentation approaches in isolation and combination, using experimental data sets with three different imaging technologies (mammograms, X-rays, and ultrasound). We demonstrate that RTDA achieves superior robustness against adversarial attacks and improved generalization performance in the presence of distribution shift in each image classification task while maintaining high clean accuracy.",http://arxiv.org/abs/2506.17133v1
Rapid and Continuous Trust Evaluation for Effective Task Collaboration Through Siamese Model,"['Botao Zhu', 'Xianbin Wang']",2025-06-20,"Trust is emerging as an effective tool to ensure the successful completion of collaborative tasks within collaborative systems. However, rapidly and continuously evaluating the trustworthiness of collaborators during task execution is a significant challenge due to distributed devices, complex operational environments, and dynamically changing resources. To tackle this challenge, this paper proposes a Siamese-enabled rapid and continuous trust evaluation framework (SRCTE) to facilitate effective task collaboration. First, the communication and computing resource attributes of the collaborator in a trusted state, along with historical collaboration data, are collected and represented using an attributed control flow graph (ACFG) that captures trust-related semantic information and serves as a reference for comparison with data collected during task execution. At each time slot of task execution, the collaborator's communication and computing resource attributes, as well as task completion effectiveness, are collected in real time and represented with an ACFG to convey their trust-related semantic information. A Siamese model, consisting of two shared-parameter Structure2vec networks, is then employed to learn the deep semantics of each pair of ACFGs and generate their embeddings. Finally, the similarity between the embeddings of each pair of ACFGs is calculated to determine the collaborator's trust value at each time slot. A real system is built using two Dell EMC 5200 servers and a Google Pixel 8 to test the effectiveness of the proposed SRCTE framework. Experimental results demonstrate that SRCTE converges rapidly with only a small amount of data and achieves a high anomaly trust detection rate compared to the baseline algorithm.",http://arxiv.org/abs/2506.17128v1
Reassessing Code Authorship Attribution in the Era of Language Models,"['Atish Kumar Dipongkor', 'Ziyu Yao', 'Kevin Moran']",2025-06-20,"The study of Code Stylometry, and in particular Code Authorship Attribution (CAA), aims to analyze coding styles to identify the authors of code samples. CAA is crucial in cybersecurity and software forensics for addressing, detecting plagiarism, and supporting criminal prosecutions. However, CAA is a complex and error prone task, due to the need for recognizing nuanced relationships between coding patterns. This challenge is compounded in large software systems with numerous authors due to the subtle variability of patterns that signify the coding style of one author among many. Given the challenges related to this task, researchers have proposed and studied automated approaches that rely upon classical Machine Learning and Deep Learning techniques. However, such techniques have historically relied upon hand-crafted features, and due to the often intricate interaction of different features (e.g., formatting, etc.), have key limitations in properly characterizing authorship, and are sensitive to adversarial code perturbations. Recently, transformer-based Language Models (LMs) have shown remarkable efficacy across a range of software engineering tasks, and in the authorship attribution on natural language in the NLP domain. However, their effectiveness in CAA is not well understood. As such, we conduct the first extensive empirical study applying two larger state-of-the-art code LMs, and five smaller code LMs to the task of CAA to 6 diverse datasets that encompass 12k code snippets written by 463 developers. Furthermore, we perform an in-depth analysis of our studied models' performance on CAA using established machine learning interpretability techniques. The results of our analysis illustrate important findings that illuminate the behavior of LMs in understanding stylometric code patterns during the task of CAA, and point towards important directions for future work.",http://arxiv.org/abs/2506.17120v1
Identifiability of Deep Polynomial Neural Networks,"['Konstantin Usevich', 'Clara Dérand', 'Ricardo Borsoi', 'Marianne Clausel']",2025-06-20,"Polynomial Neural Networks (PNNs) possess a rich algebraic and geometric structure. However, their identifiability -- a key property for ensuring interpretability -- remains poorly understood. In this work, we present a comprehensive analysis of the identifiability of deep PNNs, including architectures with and without bias terms. Our results reveal an intricate interplay between activation degrees and layer widths in achieving identifiability. As special cases, we show that architectures with non-increasing layer widths are generically identifiable under mild conditions, while encoder-decoder networks are identifiable when the decoder widths do not grow too rapidly. Our proofs are constructive and center on a connection between deep PNNs and low-rank tensor decompositions, and Kruskal-type uniqueness theorems. This yields both generic conditions determined by the architecture, and effective conditions that depend on the network's parameters. We also settle an open conjecture on the expected dimension of PNN's neurovarieties, and provide new bounds on the activation degrees required for it to reach its maximum.",http://arxiv.org/abs/2506.17093v1
Navigating the Deep: Signature Extraction on Deep Neural Networks,"['Haolin Liu', 'Adrien Siproudhis', 'Samuel Experton', 'Peter Lorenz', 'Christina Boura', 'Thomas Peyrin']",2025-06-20,"Neural network model extraction has emerged in recent years as an important security concern, as adversaries attempt to recover a network's parameters via black-box queries. A key step in this process is signature extraction, which aims to recover the absolute values of the network's weights layer by layer. Prior work, notably by Carlini et al. (2020), introduced a technique inspired by differential cryptanalysis to extract neural network parameters. However, their method suffers from several limitations that restrict its applicability to networks with a few layers only. Later works focused on improving sign extraction, but largely relied on the assumption that signature extraction itself was feasible.   In this work, we revisit and refine the signature extraction process by systematically identifying and addressing for the first time critical limitations of Carlini et al.'s signature extraction method. These limitations include rank deficiency and noise propagation from deeper layers. To overcome these challenges, we propose efficient algorithmic solutions for each of the identified issues, greatly improving the efficiency of signature extraction. Our approach permits the extraction of much deeper networks than was previously possible. We validate our method through extensive experiments on ReLU-based neural networks, demonstrating significant improvements in extraction depth and accuracy. For instance, our extracted network matches the target network on at least 95% of the input space for each of the eight layers of a neural network trained on the CIFAR-10 dataset, while previous works could barely extract the first three layers. Our results represent a crucial step toward practical attacks on larger and more complex neural network architectures.",http://arxiv.org/abs/2506.17047v1
MAWIFlow Benchmark: Realistic Flow-Based Evaluation for Network Intrusion Detection,"['Joshua Schraven', 'Alexander Windmann', 'Oliver Niggemann']",2025-06-20,"Benchmark datasets for network intrusion detection commonly rely on synthetically generated traffic, which fails to reflect the statistical variability and temporal drift encountered in operational environments. This paper introduces MAWIFlow, a flow-based benchmark derived from the MAWILAB v1.1 dataset, designed to enable realistic and reproducible evaluation of anomaly detection methods. A reproducible preprocessing pipeline is presented that transforms raw packet captures into flow representations conforming to the CICFlowMeter format, while preserving MAWILab's original anomaly labels. The resulting datasets comprise temporally distinct samples from January 2011, 2016, and 2021, drawn from trans-Pacific backbone traffic.   To establish reference baselines, traditional machine learning methods, including Decision Trees, Random Forests, XGBoost, and Logistic Regression, are compared to a deep learning model based on a CNN-BiLSTM architecture. Empirical results demonstrate that tree-based classifiers perform well on temporally static data but experience significant performance degradation over time. In contrast, the CNN-BiLSTM model maintains better performance, thus showing improved generalization. These findings underscore the limitations of synthetic benchmarks and static models, and motivate the adoption of realistic datasets with explicit temporal structure. All datasets, pipeline code, and model implementations are made publicly available to foster transparency and reproducibility.",http://arxiv.org/abs/2506.17041v1
Bayesian Joint Model of Multi-Sensor and Failure Event Data for Multi-Mode Failure Prediction,"['Sina Aghaee Dabaghan Fard', 'Minhee Kim', 'Akash Deep', 'Jaesung Lee']",2025-06-20,"Modern industrial systems are often subject to multiple failure modes, and their conditions are monitored by multiple sensors, generating multiple time-series signals. Additionally, time-to-failure data are commonly available. Accurately predicting a system's remaining useful life (RUL) requires effectively leveraging multi-sensor time-series data alongside multi-mode failure event data. In most existing models, failure modes and RUL prediction are performed independently, ignoring the inherent relationship between these two tasks. Some models integrate multiple failure modes and event prediction using black-box machine learning approaches, which lack statistical rigor and cannot characterize the inherent uncertainty in the model and data. This paper introduces a unified approach to jointly model the multi-sensor time-series data and failure time concerning multiple failure modes. This proposed model integrate a Cox proportional hazards model, a Convolved Multi-output Gaussian Process, and multinomial failure mode distributions in a hierarchical Bayesian framework with corresponding priors, enabling accurate prediction with robust uncertainty quantification. Posterior distributions are effectively obtained by Variational Bayes, and prediction is performed with Monte Carlo sampling. The advantages of the proposed model is validated through extensive numerical and case studies with jet-engine dataset.",http://arxiv.org/abs/2506.17036v1
Reframing Spatial Dependence as Geographic Feature Attribution,"['Chuan Chen', 'Peng Luo']",2025-06-20,"Spatial dependence, referring to the correlation between variable values observed at different geographic locations, is one of the most fundamental characteristics of spatial data. The presence of spatial dependence violates the classical statistical assumption of independent and identically distributed observations and implies a high degree of information redundancy within spatial datasets. However, this redundancy can also be interpreted as structured information, which has been widely leveraged in spatial modeling, prediction, and explanation tasks. With the rise of geospatial big data and the rapid advancement of deep learning and large models, effectively modeling and characterizing spatial dependence has become essential for enhancing the performance of spatial analysis and uncovering latent spatial processes. From a data-driven perspective, this study proposes a novel interpretation: spatial dependence can be understood as the contribution of geographic location -- specifically, latitude and longitude -- to the observed variation in target variables. To validate this hypothesis, we conduct simulation experiments in which data are generated based on known spatial processes. We train machine learning models to predict variable values using only coordinate information. Subsequently, XAI techniques are employed to quantify the contribution of spatial features. The resulting importance scores are then compared with local indicators of spatial association (LISA). Across a range of spatial process settings, we observe consistently high correlations (greater than 0.94) between coordinate-based contributions and LISA values. These findings offer a new data-driven perspective on spatial dependence, bridging traditional spatial statistical approaches with modern machine learning techniques.",http://arxiv.org/abs/2506.16996v1
RocketStack: A level-aware deep recursive ensemble learning framework with exploratory feature fusion and model pruning dynamics,['Çağatay Demirel'],2025-06-20,"Ensemble learning remains a cornerstone of machine learning, with stacking used to integrate predictions from multiple base learners through a meta-model. However, deep stacking remains rare, as most designs prioritize horizontal diversity over recursive depth due to model complexity, feature redundancy, and computational burden. To address these challenges, RocketStack, a level-aware recursive ensemble framework, is introduced and explored up to ten stacking levels, extending beyond prior architectures. The framework incrementally prunes weaker learners at each level, enabling deeper stacking without excessive complexity. To mitigate early performance saturation, mild Gaussian noise is added to out-of-fold (OOF) scores before pruning, and compared against strict OOF pruning. Further both per-level and periodic feature compressions are explored using attention-based selection, Simple, Fast, Efficient (SFE) filter, and autoencoders. Across 33 datasets (23 binary, 10 multi-class), linear-trend tests confirmed rising accuracy with depth in most variants, and the top performing meta-model at each level increasingly outperformed the strongest standalone ensemble. In the binary subset, periodic SFE with mild OOF-score randomization reached 97.08% at level 10, 5.14% above the strict-pruning configuration and cut runtime by 10.5% relative to no compression. In the multi-class subset, periodic attention selection reached 98.60% at level 10, exceeding the strongest baseline by 6.11%, while reducing runtime by 56.1% and feature dimensionality by 74% compared to no compression. These findings highlight mild randomization as an effective regularizer and periodic compression as a stabilizer. Echoing the design of multistage rockets in aerospace (prune, compress, propel) RocketStack achieves deep recursive ensembling with tractable complexity.",http://arxiv.org/abs/2506.16965v1
A deep learning and machine learning approach to predict neonatal death in the context of São Paulo,"['Mohon Raihan', 'Plabon Kumar Saha', 'Rajan Das Gupta', 'A Z M Tahmidul Kabir', 'Afia Anjum Tamanna', 'Md. Harun-Ur-Rashid', 'Adnan Bin Abdus Salam', 'Md Tanvir Anjum', 'A Z M Ahteshamul Kabir']",2025-06-20,"Neonatal death is still a concerning reality for underdeveloped and even some developed countries. Worldwide data indicate that 26.693 babies out of 1,000 births die, according to Macro Trades. To reduce this number, early prediction of endangered babies is crucial. Such prediction enables the opportunity to take ample care of the child and mother so that early child death can be avoided. In this context, machine learning was used to determine whether a newborn baby is at risk. To train the predictive model, historical data of 1.4 million newborns was used. Machine learning and deep learning techniques such as logical regression, K-nearest neighbor, random forest classifier, extreme gradient boosting (XGBoost), convolutional neural network, and long short-term memory (LSTM) were implemented using the dataset to identify the most accurate model for predicting neonatal mortality. Among the machine learning algorithms, XGBoost and random forest classifier achieved the best accuracy with 94%, while among the deep learning models, LSTM delivered the highest accuracy with 99%. Therefore, using LSTM appears to be the most suitable approach to predict whether precautionary measures for a child are necessary.",http://arxiv.org/abs/2506.16929v1
