title,authors,published,summary,url
Integrating Generative Adversarial Networks and Convolutional Neural Networks for Enhanced Traffic Accidents Detection and Analysis,"['Zhenghao Xi', 'Xiang Liu', 'Yaqi Liu', 'Yitong Cai', 'Yangyu Zheng']",2025-06-19,"Accident detection using Closed Circuit Television (CCTV) footage is one of the most imperative features for enhancing transport safety and efficient traffic control. To this end, this research addresses the issues of supervised monitoring and data deficiency in accident detection systems by adapting excellent deep learning technologies. The motivation arises from rising statistics in the number of car accidents worldwide; this calls for innovation and the establishment of a smart, efficient and automated way of identifying accidents and calling for help to save lives. Addressing the problem of the scarcity of data, the presented framework joins Generative Adversarial Networks (GANs) for synthesizing data and Convolutional Neural Networks (CNN) for model training. Video frames for accidents and non-accidents are collected from YouTube videos, and we perform resizing, image enhancement and image normalisation pixel range adjustments. Three models are used: CNN, Fine-tuned Convolutional Neural Network (FTCNN) and Vision Transformer (VIT) worked best for detecting accidents from CCTV, obtaining an accuracy rate of 94% and 95%, while the CNN model obtained 88%. Such results show that the proposed framework suits traffic safety applications due to its high real-time accident detection capabilities and broad-scale applicability. This work lays the foundation for intelligent surveillance systems in the future for real-time traffic monitoring, smart city framework, and integration of intelligent surveillance systems into emergency management systems.",http://arxiv.org/abs/2506.16186v1
Advancing atomic electron tomography with neural networks,"['Juhyeok Lee', 'Yongsoo Yang']",2025-06-19,"Accurate determination of three-dimensional (3D) atomic structures is crucial for understanding and controlling the properties of nanomaterials. Atomic electron tomography (AET) offers non-destructive atomic imaging with picometer-level precision, enabling the resolution of defects, interfaces, and strain fields in 3D, as well as the observation of dynamic structural evolution. However, reconstruction artifacts arising from geometric limitations and electron dose constraints can hinder reliable atomic structure determination. Recent progress has integrated deep learning, especially convolutional neural networks, into AET workflows to improve reconstruction fidelity. This review highlights recent advances in neural network-assisted AET, emphasizing its role in overcoming persistent challenges in 3D atomic imaging. By significantly enhancing the accuracy of both surface and bulk structural characterization, these methods are advancing the frontiers of nanoscience and enabling new opportunities in materials research and technology.",http://arxiv.org/abs/2506.16104v1
Geometric deep learning assists protein engineering. Opportunities and Challenges,"['Julián García-Vinuesa', 'Jorge Rojas', 'Nicole Soto-García', 'Nicolás Martínez', 'Diego Alvarez-Saravia', 'Roberto Uribe-Paredes', 'Mehdi D. Davari', 'Carlos Conca', 'Juan A. Asenjo', 'David Medina-Ortiz']",2025-06-19,"Protein engineering is experiencing a paradigmatic shift through the integration of geometric deep learning into computational design workflows. While traditional strategies, such as rational design and directed evolution, have enabled relevant advances, they remain limited by the complexity of sequence space and the cost of experimental validation. Geometric deep learning addresses these limitations by operating on non-Euclidean domains, capturing spatial, topological, and physicochemical features essential to protein function. This perspective outlines the current applications of GDL across stability prediction, functional annotation, molecular interaction modeling, and de novo protein design. We highlight recent methodological advances in model generalization, interpretability, and robustness, particularly under data-scarce conditions. A unified framework is proposed that integrates GDL with explainable AI and structure-based validation to support transparent, autonomous design. As GDL converges with generative modeling and high-throughput experimentation, it is emerging as a central technology in next-generation protein engineering and synthetic biology.",http://arxiv.org/abs/2506.16091v1
Aptamer-protein interaction prediction model based on transformer,"['Zhichao Yan', 'Yue Kang', 'Buyong Ma']",2025-06-19,"Aptamers are single-stranded DNA/RNAs or short peptides with unique tertiary structures that selectively bind to specific targets. They have great potential in the detection and medical fields. Here, we present SelfTrans-Ensemble, a deep learning model that integrates sequence information models and structural information models to extract multi-scale features for predicting aptamer-protein interactions (APIs). The model employs two pre-trained models, ProtBert and RNA-FM, to encode protein and aptamer sequences, along with features generated from primary sequence and secondary structural information. To address the data imbalance in the aptamer dataset imbalance, we incorporated short RNA-protein interaction data in the training set. This resulted in a training accuracy of 98.9% and a test accuracy of 88.0%, demonstrating the model's effectiveness in accurately predicting APIs. Additionally, analysis using molecular simulation indicated that SelfTrans-Ensemble is sensitive to aptamer sequence mutations. We anticipate that SelfTrans-Ensemble can offer a more efficient and rapid process for aptamer screening.",http://arxiv.org/abs/2506.16084v1
A Lightweight RL-Driven Deep Unfolding Network for Robust WMMSE Precoding in Massive MU-MIMO-OFDM Systems,"['Kexuan Wang', 'An Liu']",2025-06-19,"Weighted Minimum Mean Square Error (WMMSE) precoding is widely recognized for its near-optimal weighted sum rate performance. However, its practical deployment in massive multi-user (MU) multiple-input multiple-output (MIMO) orthogonal frequency-division multiplexing (OFDM) systems is hindered by the assumption of perfect channel state information (CSI) and high computational complexity. To address these issues, we first develop a wideband stochastic WMMSE (SWMMSE) algorithm that iteratively maximizes the ergodic weighted sum-rate (EWSR) under imperfect CSI. Building on this, we propose a lightweight reinforcement learning (RL)-driven deep unfolding (DU) network (RLDDU-Net), where each SWMMSE iteration is mapped to a network layer. Specifically, its DU module integrates approximation techniques and leverages beam-domain sparsity as well as frequency-domain subcarrier correlation, significantly accelerating convergence and reducing computational overhead. Furthermore, the RL module adaptively adjusts the network depth and generates compensation matrices to mitigate approximation errors. Simulation results under imperfect CSI demonstrate that RLDDU-Net outperforms existing baselines in EWSR performance while offering superior computational and convergence efficiency.",http://arxiv.org/abs/2506.16072v1
CRIA: A Cross-View Interaction and Instance-Adapted Pre-training Framework for Generalizable EEG Representations,"['Puchun Liu', 'C. L. Philip Chen', 'Yubin He', 'Tong Zhang']",2025-06-19,"The difficulty of extracting deep features from EEG data and effectively integrating information from multiple views presents significant challenges for developing a generalizable pretraining framework for EEG representation learning. However, most existing pre-training methods rely solely on the contextual semantics of a single view, failing to capture the complex and synergistic interactions among different perspectives, limiting the expressiveness and generalization of learned representations. To address these issues, this paper proposes CRIA, an adaptive framework that utilizes variable-length and variable-channel coding to achieve a unified representation of EEG data across different datasets. In this work, we define cross-view information as the integrated representation that emerges from the interaction among temporal, spectral, and spatial views of EEG signals. The model employs a cross-attention mechanism to fuse temporal, spectral, and spatial features effectively, and combines an attention matrix masking strategy based on the information bottleneck principle with a novel viewpoint masking pre-training scheme. Experimental results on the Temple University EEG corpus and the CHB-MIT dataset show that CRIA outperforms existing methods with the same pre-training conditions, achieving a balanced accuracy of 57.02% for multi-class event classification and 80.03% for anomaly detection, highlighting its strong generalization ability.",http://arxiv.org/abs/2506.16056v1
VRAIL: Vectorized Reward-based Attribution for Interpretable Learning,"['Jina Kim', 'Youjin Jang', 'Jeongjin Han']",2025-06-19,"We propose VRAIL (Vectorized Reward-based Attribution for Interpretable Learning), a bi-level framework for value-based reinforcement learning (RL) that learns interpretable weight representations from state features. VRAIL consists of two stages: a deep learning (DL) stage that fits an estimated value function using state features, and an RL stage that uses this to shape learning via potential-based reward transformations. The estimator is modeled in either linear or quadratic form, allowing attribution of importance to individual features and their interactions. Empirical results on the Taxi-v3 environment demonstrate that VRAIL improves training stability and convergence compared to standard DQN, without requiring environment modifications. Further analysis shows that VRAIL uncovers semantically meaningful subgoals, such as passenger possession, highlighting its ability to produce human-interpretable behavior. Our findings suggest that VRAIL serves as a general, model-agnostic framework for reward shaping that enhances both learning and interpretability.",http://arxiv.org/abs/2506.16014v1
DIGMAPPER: A Modular System for Automated Geologic Map Digitization,"['Weiwei Duan', 'Michael P. Gerlek', 'Steven N. Minton', 'Craig A. Knoblock', 'Fandel Lin', 'Theresa Chen', 'Leeje Jang', 'Sofia Kirsanova', 'Zekun Li', 'Yijun Lin', 'Yao-Yi Chiang']",2025-06-19,"Historical geologic maps contain rich geospatial information, such as rock units, faults, folds, and bedding planes, that is critical for assessing mineral resources essential to renewable energy, electric vehicles, and national security. However, digitizing maps remains a labor-intensive and time-consuming task. We present DIGMAPPER, a modular, scalable system developed in collaboration with the United States Geological Survey (USGS) to automate the digitization of geologic maps. DIGMAPPER features a fully dockerized, workflow-orchestrated architecture that integrates state-of-the-art deep learning models for map layout analysis, feature extraction, and georeferencing. To overcome challenges such as limited training data and complex visual content, our system employs innovative techniques, including in-context learning with large language models, synthetic data generation, and transformer-based models. Evaluations on over 100 annotated maps from the DARPA-USGS dataset demonstrate high accuracy across polygon, line, and point feature extraction, and reliable georeferencing performance. Deployed at USGS, DIGMAPPER significantly accelerates the creation of analysis-ready geospatial datasets, supporting national-scale critical mineral assessments and broader geoscientific applications.",http://arxiv.org/abs/2506.16006v1
The investigation of 84 TESS totally eclipsing contact binaries,"['Yani Guo', 'Kai Li', 'Liheng Wang', 'Qiqi Xia', 'Xiang Gao', 'Jingran Xu', 'Jingyi Wang']",2025-06-19,"Based on the eclipsing binary catalog provided by \cite{2022ApJS..258...16P}, 84 totally eclipsing contact binaries with stable light curves were selected. The TESS light curves of these 84 targets were studied using the Physics Of Eclipsing Binaries code. The results indicate that there are 18 deep contact binaries, 39 moderate contact binaries, and 27 shallow contact binaries. Among them, 43 targets exhibit the O'Connell effect, which is attributed to the presence of star-spot on the component's surface. 15 targets are low-mass ratio deep contact binaries and may be contact binary merging candidates. Based on the relationship between the period and semi-major axis of contact binaries, their absolute physical parameters such as mass, radius, and luminosity were derived. The evolutionary status of these 84 targets was studied using the mass-luminosity and mass-radius relation diagrams. Their initial masses were also estimated. Our results are compared with those of targets that have been historically studied. Among the 84 targets, 44 targets have been studied before, and 21 of these have mass ratios $q$ that are consistent with historical values within a 10\% difference. For the inconsistent targets, we conducted a detailed investigation and found that the main reasons are poor quality of historical data, or the fact that the machine learning methods used in historical studies might not accurately determine the physical parameters for individual targets.",http://arxiv.org/abs/2506.15989v1
Towards Classifying Histopathological Microscope Images as Time Series Data,"['Sungrae Hong', 'Hyeongmin Park', 'Youngsin Ko', 'Sol Lee', 'Bryan Wong', 'Mun Yong Yi']",2025-06-19,"As the frontline data for cancer diagnosis, microscopic pathology images are fundamental for providing patients with rapid and accurate treatment. However, despite their practical value, the deep learning community has largely overlooked their usage. This paper proposes a novel approach to classifying microscopy images as time series data, addressing the unique challenges posed by their manual acquisition and weakly labeled nature. The proposed method fits image sequences of varying lengths to a fixed-length target by leveraging Dynamic Time-series Warping (DTW). Attention-based pooling is employed to predict the class of the case simultaneously. We demonstrate the effectiveness of our approach by comparing performance with various baselines and showcasing the benefits of using various inference strategies in achieving stable and reliable results. Ablation studies further validate the contribution of each component. Our approach contributes to medical image analysis by not only embracing microscopic images but also lifting them to a trustworthy level of performance.",http://arxiv.org/abs/2506.15977v1
TrainVerify: Equivalence-Based Verification for Distributed LLM Training,"['Yunchi Lu', 'Youshan Miao', 'Cheng Tan', 'Peng Huang', 'Yi Zhu', 'Xian Zhang', 'Fan Yang']",2025-06-19,"Training large language models (LLMs) at scale requires parallel execution across thousands of devices, incurring enormous computational costs. Yet, these costly distributed trainings are rarely verified, leaving them prone to silent errors and potentially wasting millions of GPU hours. We introduce TrainVerify, a system for verifiable distributed training of LLMs. Given a deep learning model's logical specification as the ground truth, TrainVerify formally verifies that a distributed parallel execution plan is mathematically equivalent to it. Direct verification is notoriously difficult due to the sheer scale of LLMs which often involves billions of variables and highly intricate computation graphs. Therefore, TrainVerify introduces shape-reduction techniques and a stage-wise parallel verification algorithm that significantly reduces complexity while preserving formal correctness. TrainVerify scales to frontier LLMs, including the successful verification of the Llama3 (405B) and DeepSeek-V3 (671B) training plans.",http://arxiv.org/abs/2506.15961v1
One Period to Rule Them All: Identifying Critical Learning Periods in Deep Networks,"['Vinicius Yuiti Fukase', 'Heitor Gama', 'Barbara Bueno', 'Lucas Libanio', 'Anna Helena Reali Costa', 'Artur Jordao']",2025-06-19,"Critical Learning Periods comprehend an important phenomenon involving deep learning, where early epochs play a decisive role in the success of many training recipes, such as data augmentation. Existing works confirm the existence of this phenomenon and provide useful insights. However, the literature lacks efforts to precisely identify when critical periods occur. In this work, we fill this gap by introducing a systematic approach for identifying critical periods during the training of deep neural networks, focusing on eliminating computationally intensive regularization techniques and effectively applying mechanisms for reducing computational costs, such as data pruning. Our method leverages generalization prediction mechanisms to pinpoint critical phases where training recipes yield maximum benefits to the predictive ability of models. By halting resource-intensive recipes beyond these periods, we significantly accelerate the learning phase and achieve reductions in training time, energy consumption, and CO$_2$ emissions. Experiments on standard architectures and benchmarks confirm the effectiveness of our method. Specifically, we achieve significant milestones by reducing the training time of popular architectures by up to 59.67%, leading to a 59.47% decrease in CO$_2$ emissions and a 60% reduction in financial costs, without compromising performance. Our work enhances understanding of training dynamics and paves the way for more sustainable and efficient deep learning practices, particularly in resource-constrained environments. In the era of the race for foundation models, we believe our method emerges as a valuable framework. The repository is available at https://github.com/baunilhamarga/critical-periods",http://arxiv.org/abs/2506.15954v1
Polyline Path Masked Attention for Vision Transformer,"['Zhongchen Zhao', 'Chaodong Xiao', 'Hui Lin', 'Qi Xie', 'Lei Zhang', 'Deyu Meng']",2025-06-19,"Global dependency modeling and spatial position modeling are two core issues of the foundational architecture design in current deep learning frameworks. Recently, Vision Transformers (ViTs) have achieved remarkable success in computer vision, leveraging the powerful global dependency modeling capability of the self-attention mechanism. Furthermore, Mamba2 has demonstrated its significant potential in natural language processing tasks by explicitly modeling the spatial adjacency prior through the structured mask. In this paper, we propose Polyline Path Masked Attention (PPMA) that integrates the self-attention mechanism of ViTs with an enhanced structured mask of Mamba2, harnessing the complementary strengths of both architectures. Specifically, we first ameliorate the traditional structured mask of Mamba2 by introducing a 2D polyline path scanning strategy and derive its corresponding structured mask, polyline path mask, which better preserves the adjacency relationships among image tokens. Notably, we conduct a thorough theoretical analysis on the structural characteristics of the proposed polyline path mask and design an efficient algorithm for the computation of the polyline path mask. Next, we embed the polyline path mask into the self-attention mechanism of ViTs, enabling explicit modeling of spatial adjacency prior. Extensive experiments on standard benchmarks, including image classification, object detection, and segmentation, demonstrate that our model outperforms previous state-of-the-art approaches based on both state-space models and Transformers. For example, our proposed PPMA-T/S/B models achieve 48.7%/51.1%/52.3% mIoU on the ADE20K semantic segmentation task, surpassing RMT-T/S/B by 0.7%/1.3%/0.3%, respectively. Code is available at https://github.com/zhongchenzhao/PPMA.",http://arxiv.org/abs/2506.15940v1
MoiréXNet: Adaptive Multi-Scale Demoiréing with Linear Attention Test-Time Training and Truncated Flow Matching Prior,"['Liangyan Li', 'Yimo Ning', 'Kevin Le', 'Wei Dong', 'Yunzhe Li', 'Jun Chen', 'Xiaohong Liu']",2025-06-19,"This paper introduces a novel framework for image and video demoir\'eing by integrating Maximum A Posteriori (MAP) estimation with advanced deep learning techniques. Demoir\'eing addresses inherently nonlinear degradation processes, which pose significant challenges for existing methods.   Traditional supervised learning approaches either fail to remove moir\'e patterns completely or produce overly smooth results. This stems from constrained model capacity and scarce training data, which inadequately represent the clean image distribution and hinder accurate reconstruction of ground-truth images. While generative models excel in image restoration for linear degradations, they struggle with nonlinear cases such as demoir\'eing and often introduce artifacts.   To address these limitations, we propose a hybrid MAP-based framework that integrates two complementary components. The first is a supervised learning model enhanced with efficient linear attention Test-Time Training (TTT) modules, which directly learn nonlinear mappings for RAW-to-sRGB demoir\'eing. The second is a Truncated Flow Matching Prior (TFMP) that further refines the outputs by aligning them with the clean image distribution, effectively restoring high-frequency details and suppressing artifacts. These two components combine the computational efficiency of linear attention with the refinement abilities of generative models, resulting in improved restoration performance.",http://arxiv.org/abs/2506.15929v1
"Entangling Disciplines: Causality, Entropy and Time-Travel Paradoxes on a Quantum Computer",['Maria Violaris'],2025-06-18,"Merging disciplines has led to incredible learnings and breakthroughs throughout history, including the discovery of quantum computing: a cross between computation and quantum physics. In this paper, I will discuss how we can cross quantum computing with topics in fundamental physics. This leads to fruitful, interactive learning opportunities that fuse deep open physics problems with key insights about quantum information science. By outlining quantum circuit experiments that can be run on current and near-term quantum computers, I demonstrate how to help learners engage with principles in special relativity, general relativity and thermodynamics. In turn, these connections can advance their understanding of quantum computing. Learners can further explore the quantum computing activities in this paper via the Quantum Paradoxes content series of videos, blogs and code tutorials that I created with IBM Quantum.",http://arxiv.org/abs/2506.15909v1
Pediatric Pancreas Segmentation from MRI Scans with Deep Learning,"['Elif Keles', 'Merve Yazol', 'Gorkem Durak', 'Ziliang Hong', 'Halil Ertugrul Aktas', 'Zheyuan Zhang', 'Linkai Peng', 'Onkar Susladkar', 'Necati Guzelyel', 'Oznur Leman Boyunaga', 'Cemal Yazici', 'Mark Lowe', 'Aliye Uc', 'Ulas Bagci']",2025-06-18,"Objective: Our study aimed to evaluate and validate PanSegNet, a deep learning (DL) algorithm for pediatric pancreas segmentation on MRI in children with acute pancreatitis (AP), chronic pancreatitis (CP), and healthy controls. Methods: With IRB approval, we retrospectively collected 84 MRI scans (1.5T/3T Siemens Aera/Verio) from children aged 2-19 years at Gazi University (2015-2024). The dataset includes healthy children as well as patients diagnosed with AP or CP based on clinical criteria. Pediatric and general radiologists manually segmented the pancreas, then confirmed by a senior pediatric radiologist. PanSegNet-generated segmentations were assessed using Dice Similarity Coefficient (DSC) and 95th percentile Hausdorff distance (HD95). Cohen's kappa measured observer agreement. Results: Pancreas MRI T2W scans were obtained from 42 children with AP/CP (mean age: 11.73 +/- 3.9 years) and 42 healthy children (mean age: 11.19 +/- 4.88 years). PanSegNet achieved DSC scores of 88% (controls), 81% (AP), and 80% (CP), with HD95 values of 3.98 mm (controls), 9.85 mm (AP), and 15.67 mm (CP). Inter-observer kappa was 0.86 (controls), 0.82 (pancreatitis), and intra-observer agreement reached 0.88 and 0.81. Strong agreement was observed between automated and manual volumes (R^2 = 0.85 in controls, 0.77 in diseased), demonstrating clinical reliability. Conclusion: PanSegNet represents the first validated deep learning solution for pancreatic MRI segmentation, achieving expert-level performance across healthy and diseased states. This tool, algorithm, along with our annotated dataset, are freely available on GitHub and OSF, advancing accessible, radiation-free pediatric pancreatic imaging and fostering collaborative research in this underserved domain.",http://arxiv.org/abs/2506.15908v1
Deep Reinforcement Learning Xiangqi Player with Monte Carlo Tree Search,"['Berk Yilmaz', 'Junyu Hu', 'Jinsong Liu']",2025-06-18,"This paper presents a Deep Reinforcement Learning (DRL) system for Xiangqi (Chinese Chess) that integrates neural networks with Monte Carlo Tree Search (MCTS) to enable strategic self-play and self-improvement. Addressing the underexplored complexity of Xiangqi, including its unique board layout, piece movement constraints, and victory conditions, our approach combines policy-value networks with MCTS to simulate move consequences and refine decision-making. By overcoming challenges such as Xiangqi's high branching factor and asymmetrical piece dynamics, our work advances AI capabilities in culturally significant strategy games while providing insights for adapting DRL-MCTS frameworks to domain-specific rule systems.",http://arxiv.org/abs/2506.15880v1
